{
  "$schema": "http://json-schema.org/draft-07/schema#",
  "title": "DeDi Endpoint Record",
  "description": "A machine-readable endpoint advertisement for a DeDi participant. Use this schema to publish the service URLs, transport protocols, and associated key identifiers for an entity whose endpoints need to be discoverable.",
  "type": "object",
  "additionalProperties": false,
  "required": ["endpoint_id", "subscriber_id", "endpoints"],
  "properties": {
    "endpoint_id": {
      "type": "string",
      "description": "Unique identifier for this endpoint record."
    },
    "subscriber_id": {
      "type": "string",
      "description": "Identifier of the entity that owns these endpoints."
    },
    "endpoints": {
      "type": "array",
      "minItems": 1,
      "description": "One or more endpoint entries for this entity.",
      "items": {
        "type": "object",
        "additionalProperties": false,
        "required": ["url", "type"],
        "properties": {
          "url": {
            "type": "string",
            "format": "uri",
            "description": "The fully-qualified endpoint URL."
          },
          "type": {
            "type": "string",
            "description": "The service or protocol type this endpoint provides. Examples: callback, webhook, api, grpc.",
            "examples": ["callback", "webhook", "api", "grpc"]
          },
          "status": {
            "type": "string",
            "enum": ["active", "deprecated", "inactive"],
            "description": "Operational status of this endpoint."
          },
          "signing_key_id": {
            "type": "string",
            "description": "Optional reference to the public key used to sign requests sent to or from this endpoint."
          },
          "activatedAt": {
            "type": "string",
            "format": "date-time",
            "description": "When this endpoint was activated."
          },
          "retiredAt": {
            "type": "string",
            "format": "date-time",
            "description": "When this endpoint was retired, if applicable."
          }
        }
      }
    },
    "publishedAt": {
      "type": "string",
      "format": "date-time",
      "description": "When this endpoint record was published or last updated."
    }
  }
}
