{
  "endpoint_id": "endpoint-merchant-123",
  "subscriber_id": "did:example:merchant-123",
  "endpoints": [
    {
      "url": "https://merchant.example.org/api/v1/callback",
      "type": "callback",
      "status": "active",
      "signing_key_id": "did:example:merchant-123",
      "activatedAt": "2026-01-01T00:00:00Z"
    },
    {
      "url": "https://merchant.example.org/api/v1/webhook",
      "type": "webhook",
      "status": "deprecated",
      "activatedAt": "2025-01-01T00:00:00Z",
      "retiredAt": "2026-03-01T00:00:00Z"
    }
  ],
  "publishedAt": "2026-03-31T00:00:00Z"
}
